{
  "dataset_version": "v1",
  "fixtures": [
    {
      "best_of": "Bo3",
      "best_of_int": 3,
      "bo5_unvalidated": false,
      "coverage_mass": 0.004693347375233099,
      "event": "P6 Measured Run",
      "map_leverage": [
        {
          "flips_favorite": false,
          "map_name": "Split",
          "n_vetos_backing": 7,
          "p_a_given_not": 0.3675086442040276,
          "p_a_given_played": 0.36704777214390955,
          "p_played": 0.7022428751887365,
          "swing": -0.00046087206011807824
        },
        {
          "flips_favorite": false,
          "map_name": "Lotus",
          "n_vetos_backing": 3,
          "p_a_given_not": 0.36704777214390955,
          "p_a_given_played": 0.3675086442040276,
          "p_played": 0.2977571248112635,
          "swing": 0.00046087206011807824
        }
      ],
      "match_id": "p6-measured-1",
      "narrative": "",
      "outcome_order": [
        [
          2,
          0
        ],
        [
          2,
          1
        ],
        [
          1,
          2
        ],
        [
          0,
          2
        ]
      ],
      "overall": {
        "greedy_rank": 1,
        "greedy_veto": [
          {
            "action": "ban",
            "map_name": "Haven",
            "step_index": 0,
            "team": "397",
            "team_name": "BBL Esports"
          },
          {
            "action": "ban",
            "map_name": "Abyss",
            "step_index": 1,
            "team": "20085",
            "team_name": "Fire Flux Esports"
          },
          {
            "action": "pick",
            "map_name": "Sunset",
            "step_index": 2,
            "team": "397",
            "team_name": "BBL Esports"
          },
          {
            "action": "pick",
            "map_name": "Ascent",
            "step_index": 3,
            "team": "20085",
            "team_name": "Fire Flux Esports"
          },
          {
            "action": "ban",
            "map_name": "Lotus",
            "step_index": 4,
            "team": "397",
            "team_name": "BBL Esports"
          },
          {
            "action": "ban",
            "map_name": "Summit",
            "step_index": 5,
            "team": "20085",
            "team_name": "Fire Flux Esports"
          },
          {
            "action": "decider",
            "map_name": "Split",
            "step_index": 6,
            "team": null,
            "team_name": null
          }
        ],
        "p_a_wins_series": 0.36949320567063026,
        "per_map": [
          {
            "interval_high": [
              0.3610479798744644,
              0.07866770242138295,
              0.08290022309078382,
              0.5326843199446001
            ],
            "interval_low": [
              0.3358643416171215,
              0.04788266086346919,
              0.05838503931746642,
              0.5025677328707117
            ],
            "map_name": "Sunset",
            "n_games_backing": 1,
            "p_a_wins_map": 0.4158455525023792,
            "p_overtime": 0.12288695108181774,
            "probabilities": [
              0.3459976500188752,
              0.06984790248350398,
              0.053039048598313765,
              0.531115398899307
            ]
          },
          {
            "interval_high": [
              0.3577659613751924,
              0.07782897547489012,
              0.08257160763643312,
              0.5362474730952648
            ],
            "interval_low": [
              0.3268848973006627,
              0.047708262537766964,
              0.05827830299177584,
              0.5127145195880141
            ],
            "map_name": "Ascent",
            "n_games_backing": 2,
            "p_a_wins_map": 0.40950403386040124,
            "p_overtime": 0.12227332074510305,
            "probabilities": [
              0.34010114323713303,
              0.06940289062326821,
              0.052870430121834844,
              0.537625536017764
            ]
          },
          {
            "interval_high": [
              0.35526491398664206,
              0.07832556457043809,
              0.08276849617966532,
              0.5389365387096133
            ],
            "interval_low": [
              0.3320014594765657,
              0.04760254028533213,
              0.05819600701841242,
              0.5069044797733309
            ],
            "map_name": "Split",
            "n_games_backing": 4,
            "p_a_wins_map": 0.40587878552296686,
            "p_overtime": 0.1219047782673865,
            "probabilities": [
              0.33673992691391946,
              0.0691388586090474,
              0.0527659196583391,
              0.541355294818694
            ]
          }
        ],
        "series_probabilities": [
          0.16935763188813557,
          0.20013557378249466,
          0.2842327755343481,
          0.34627401879502157
        ],
        "veto_sensitivity": {
          "band_widths": [
            0.010579442713147008,
            0.00952936633708712,
            0.01070351775626921,
            0.015201537767209228
          ],
          "mean_band_width": 0.011503466143428141,
          "unweighted_band_high": [
            0.17518369251433208,
            0.20539587780201116,
            0.2887945645099718,
            0.35317519737009256
          ],
          "unweighted_band_low": [
            0.16460424980118507,
            0.19586651146492404,
            0.2780910467537026,
            0.33797365960288334
          ],
          "weighted_mean": [
            0.1693576318881356,
            0.2001355737824947,
            0.28423277553434817,
            0.3462740187950216
          ],
          "weighted_variance": [
            1.0956989177084733e-05,
            8.54518600277803e-06,
            1.0138970519167065e-05,
            2.2611247213277448e-05
          ]
        }
      },
      "scheduled_at": "2026-09-01T10:00:00",
      "scoreline_labels": [
        "2-0",
        "2-1",
        "1-2",
        "0-2"
      ],
      "team_a": {
        "id": "397",
        "name": "BBL Esports"
      },
      "team_b": {
        "id": "20085",
        "name": "Fire Flux Esports"
      },
      "top_vetos": [
        {
          "actions": [
            {
              "action": "ban",
              "map_name": "Haven",
              "step_index": 0,
              "team": "397",
              "team_name": "BBL Esports"
            },
            {
              "action": "ban",
              "map_name": "Abyss",
              "step_index": 1,
              "team": "20085",
              "team_name": "Fire Flux Esports"
            },
            {
              "action": "pick",
              "map_name": "Sunset",
              "step_index": 2,
              "team": "397",
              "team_name": "BBL Esports"
            },
            {
              "action": "pick",
              "map_name": "Ascent",
              "step_index": 3,
              "team": "20085",
              "team_name": "Fire Flux Esports"
            },
            {
              "action": "ban",
              "map_name": "Lotus",
              "step_index": 4,
              "team": "397",
              "team_name": "BBL Esports"
            },
            {
              "action": "ban",
              "map_name": "Summit",
              "step_index": 5,
              "team": "20085",
              "team_name": "Fire Flux Esports"
            },
            {
              "action": "decider",
              "map_name": "Split",
              "step_index": 6,
              "team": null,
              "team_name": null
            }
          ],
          "favorite_flips": false,
          "p_a_wins_series": 0.3670477721439095,
          "per_map": [
            {
              "interval_high": [
                0.3610479798744644,
                0.07866770242138295,
                0.08290022309078382,
                0.5326843199446001
              ],
              "interval_low": [
                0.3358643416171215,
                0.04788266086346919,
                0.05838503931746642,
                0.5025677328707117
              ],
              "map_name": "Sunset",
              "n_games_backing": 1,
              "p_a_wins_map": 0.4158455525023792,
              "p_overtime": 0.12288695108181774,
              "probabilities": [
                0.3459976500188752,
                0.06984790248350398,
                0.053039048598313765,
                0.531115398899307
              ]
            },
            {
              "interval_high": [
                0.3577659613751924,
                0.07782897547489012,
                0.08257160763643312,
                0.5362474730952648
              ],
              "interval_low": [
                0.3268848973006627,
                0.047708262537766964,
                0.05827830299177584,
                0.5127145195880141
              ],
              "map_name": "Ascent",
              "n_games_backing": 2,
              "p_a_wins_map": 0.40950403386040124,
              "p_overtime": 0.12227332074510305,
              "probabilities": [
                0.34010114323713303,
                0.06940289062326821,
                0.052870430121834844,
                0.537625536017764
              ]
            },
            {
              "interval_high": [
                0.35526491398664206,
                0.07832556457043809,
                0.08276849617966532,
                0.5389365387096133
              ],
              "interval_low": [
                0.3320014594765657,
                0.04760254028533213,
                0.05819600701841242,
                0.5069044797733309
              ],
              "map_name": "Split",
              "n_games_backing": 4,
              "p_a_wins_map": 0.40587878552296686,
              "p_overtime": 0.1219047782673865,
              "probabilities": [